Stars,Month,Year,Sentiment_label,Review_text
3.0,December,2023,positive,Ok
2.0,February,2024,positive,"The product is good but delivery is not, one  item was missing."
3.0,April,2023,negative,Good reach because of the taper. Not so good compared to other brands I've used in the past because bristles are beginning to bend over within a matter of a few weeks of use.
1.0,January,2024,negative,Don't Buy it . Duplicate product is  selling and you can't use it
3.0,May,2023,negative,It was stated as with soft bristles. Actually  it is very hard. No use for those who are using soft brushes.
3.0,May,2023,positive,hard
1.0,December,2023,negative,This time these brushes are very hard even blood comes in my teeth. Why these brushes are too hard .I purchased other brushes from market.they were soft but why this time hard
3.0,February,2023,positive,Did not last as long as the exact same toothbrush I had bought abroad.
1.0,December,2023,negative,Bristles are very hard that can harm mouth linings and gums
3.0,December,2022,negative,I would prefer ultrasoft. This is okay for people whose gums are strong.
1.0,September,2023,negative,I ordered this truth brush and it has not reached me yet.I feel very bad about thisthis is very bad workno one orders thisये ट्रुथ ब्रश मैंने आर्डर किया था ये अभी तक मेरे पास नै पंहुचा हैये मुझे बहुत ख़राब लगा हैये बहुत घटिया काम हैइसे कोई भी आर्डर न करे
3.0,July,2022,negative,Earlier it used to be more soft now sensodyne has reduced its quality and launched another product with same look like &  branding it as ultra soft....nice trick...very bad & sad
3.0,May,2021,positive,Packing was 3 times. Still the main packing was tempered/torn. I didn't like it.It was toothbrush set 2. I m thankful to God the product is same. Qty. Also ok.Amazon should improve on delivery. Three stars not to product but Amazon delivery.
3.0,July,2022,positive,Nice one.very soft. Less teeth abrasion.go for it.
3.0,February,2022,negative,Not much softness. Taken extra money. This is ridiculous
1.0,September,2023,negative,"Very hard, not good don't buy"
3.0,July,2021,negative,handles are too flimsy... quality is degrading every time I buy a toothbrush from Sensodyne brand.
3.0,July,2021,positive,"The brush is soft in nature,cleaning of teeth is also well."
1.0,July,2023,positive,Economy product.expect such quality tool
1.0,June,2023,negative,We can use only for a month.waste of moneyDon't buy
3.0,July,2021,neutral,Bristles are not soft
3.0,June,2021,negative,Received one brush with damaged Brussels.
1.0,June,2023,positive,"I ordered 5, but received 4"
3.0,June,2021,neutral,Not original product
1.0,May,2023,positive,ITS A HARD BRISTLE BRUSH... HARSH ON TEETH. HIGHLY DISSAPOINTED.
1.0,July,2023,positive,Gh
1.0,December,2022,neutral,This is not a soft brush as claimed by them. Dentist advised me to use soft bristle brushes as I have sensitive teeth but this brush is very hard and not gentle on sensitive teeth.
3.0,February,2019,negative,Toothbrush quality of bristle is not good. Sebsodyne is good company but this product they failed. not worth it
1.0,May,2021,negative,"Useless brisells are hard it isnt enamel friendly n for gums too my mom used it once before so she asked me to order again, but now aftr 1 use , she dosnt wana use it again i brought another brush for her, not worth the money , i myself hv used the same product before taken from other plc n  it was soft ,👎 now its become worst ..!!"
3.0,July,2020,negative,Not so good
1.0,July,2022,negative,Never Buy this as it is costlier than MRP and actual MRP is concealed with permanent marker.Also It didn’t bears Soft Bristles.No one listen to your problem as the product is non- returnable. Purchase at your own Risk ..
1.0,April,2023,positive,
3.0,January,2018,negative,I am fan of Oral-B... this one not to the quality of Oral-B..quality wise it is equal to colgate in my opinion..
1.0,January,2023,negative,Don’t sale such a defective product
3.0,November,2017,positive,"Brush is really nice and soft,  however the rubber grip develops black mold within a few days which is hard to get rid of."
2.0,June,2021,neutral,I'm not a fan
3.0,May,2017,negative,Bristles are dense but some are scattered which is not expected. It feels bad while brushing. May be manufactured defective.
3.0,August,2019,positive,Hdducux
3.0,July,2016,positive,"Far better than oral B and other brands. Its very smooth in mouth from 1st use. THough bought at MRP, still worthy.Stop using free supplied toothbrushes."
3.0,August,2017,positive,The price is little bit high but that's not much. The brushes are all good.
3.0,May,2019,positive,Good
3.0,December,2017,negative,Very soft bristles. Would prefer something a little firmer to remove the plaque.
1.0,June,2021,negative,"The bristles are harder on gums..it will take away the enamel. I spwnt additional shipment cost for this ,more than the brush cost.. total waste."
3.0,May,2017,negative,Bristles were not soft as they were compared to other toothbrushes. They are bit harder.
3.0,October,2018,positive,Can go with it.
3.0,July,2018,neutral,too soft
1.0,October,2022,positive,Just Ok
3.0,October,2018,positive,Nice product
3.0,October,2018,positive,Nice
3.0,December,2016,positive,worth for this price. little hard in feel. over all acceptable.
3.0,May,2017,neutral,It's not as soft as the Colgate one
2.0,October,2018,neutral,Brush is soft but not long lasting...max one or 2 month can be used
3.0,April,2018,positive,Good.
1.0,May,2021,negative,"No softness, brush is very hard like very poor quality brush..don't buy"
3.0,February,2018,positive,ok
3.0,January,2017,negative,tip of the brush is small!
3.0,April,2018,positive,ok
2.0,June,2017,neutral,"The bristles are not very soft, and the body is also very substandard quality. Its a cheap product in a nutshell so don't expect it to be great."
3.0,August,2017,positive,good product
2.0,December,2016,neutral,"Recived today (on 31 Dec 2016 ), Not totally satisfied with the product, its 1 year old manufactured(on Dec 2015). And I didn't find anything special and different in this toothbrush."
3.0,July,2017,positive,okay product
3.0,April,2015,neutral,but out side for this sensodyne paste brush will free but you didn't give it
2.0,May,2019,positive,Ok. Not as expected
3.0,May,2017,neutral,not lasting
1.0,July,2021,negative,Product found in bad shape
3.0,January,2017,positive,soft toothbrush from Sensodyne
3.0,October,2016,positive,ok
1.0,June,2020,negative,I ordered a set of three toothbrushes which but I got only one.  Why??
1.0,August,2021,positive,Poor quality
1.0,January,2021,negative,Not bad!! Not much comfortable
3.0,November,2016,positive,nice product
3.0,January,2017,positive,Okkk
3.0,October,2016,positive,Oh product...
1.0,April,2021,negative,Poor
3.0,October,2016,positive,Good
3.0,October,2016,positive,good
3.0,October,2016,positive,
3.0,June,2016,positive,its okey
2.0,April,2018,negative,i have returned
2.0,January,2017,negative,Sensodyne brushes used to be great but now there quality is getting degraded with popularity.
2.0,September,2017,negative,Not good product in this price
3.0,June,2015,positive,good
2.0,May,2017,negative,So Baddd.  This is 3-12 years baby product
1.0,December,2018,neutral,Not for sensitive teeth. It's just soft. We need suave or ultra soft for sensitive teeth. Can't even return
3.0,February,2015,positive,nice paste
3.0,February,2015,positive,its ok
1.0,February,2016,negative,The product MRP Rs 50. But here it is Rs 100. Why?This is one type of Cheating. I recommends to my friends not to buy this product with this excess price. One can shop it at Rs 50 at his nearest shop.
2.0,September,2016,negative,its not good product 15 days and brush remove dont west money
2.0,October,2016,negative,Its Top Brand but not great than oral b PRO
2.0,January,2017,positive,"I got same delivery, products are ok"
1.0,October,2017,neutral,Revised MRP is RS.90/- and you have sold as MRP Rs.100/- and RS.90/- after discount.Actually there is no discount.You have sold at MRP only
1.0,July,2018,positive,Old Product. Selling 1 brush for 45 where I could see 3 brush for 90 rupees in the market.
1.0,May,2017,negative,"I disliked it fir it's size as it is just a bit bigger than a baby brush, moreover, it is not the least sensitive, lie Sensodyne's toothpaste."
2.0,November,2016,positive,OKK
1.0,June,2019,negative,I received damaged products
1.0,July,2019,positive,Bad
1.0,October,2018,negative,"Bought for my mother, was not very helpful as expected."
1.0,March,2017,neutral,It is not soft like market product. Don't  order if you want soft toothbrush. It is hard.
1.0,June,2016,positive,It was mentioned as 100 rupees worth toothbrush. I paid for delivery as well. But it shows Rs.50 as price.
1.0,May,2018,positive,duplicates
