stars,month,year,sentiment,review
5.0,February,2024,positive,Excellent
1.0,December,2023,negative,I had to stop using it coz it hurt my gums. My dentist stopped my usage.
4.0,December,2023,negative,"Total care mild, is MILD in action but TOTAL in oral protection."
4.0,December,2023,positive,should be priced around 200 or less. Is lot better than strong ones.
1.0,October,2023,negative,The material in the bottle seems dialuted
5.0,October,2023,positive,I liked it more than others specially the taste
4.0,September,2023,positive,This variant has a much milder flavor than the mint or original yellow listerine.Quite nice.
5.0,September,2023,positive,Good item
5.0,September,2023,positive,"It leaves mouth, super clean and dry, as if you have visited dentist for flouride treatment...really good"
