stars,month,year,sentiment,review
1.0,February,2024,positive,Very hard and rough bristles
1.0,February,2024,negative,Brush is very hard.
1.0,January,2024,positive,Very hard
5.0,January,2024,positive,"The Oral-B Pro Health Gum Care Soft Toothbrush has become our go-to choice for daily dental hygiene. Its consistent performance, combined with the value-packed offer, makes it a staple in our household. Without a doubt, this will remain a repeat purchase for us."
1.0,January,2024,negative,"The bristles are hard, not soft.Disappointed with my buy and I bought 8 toothbrushes, sadly!!"
5.0,December,2023,positive,Must go for this toothbrush . Very nice toothbrush .
1.0,November,2023,positive,Bad quality
5.0,October,2023,positive,Great Toothbrush. Cleans the whole mouth and has a life of 2 months. Perfect. @160Rs. per pack of 4
1.0,September,2023,positive,Didnt like quality. Received hard bristle in packaging of soft bristle
